{
  "surface_kind": "opl_bundled_full_runtime_package_catalog.v1",
  "schema_ref": "contracts/opl-framework/bundled-full-runtime-package-catalog.schema.json",
  "catalog_id": "opl-framework-bundled-full-runtime-packages",
  "packages": {
    "mas": {
      "package_id": "mas",
      "package_role": "standard_agent",
      "package_version": "0.2.24",
      "owner_source_commit": "72cd9ff1310826ea8264732df53d7b9f31594618",
      "manifest_ref": "packages/mas-0.2.24.json",
      "manifest_sha256": "sha256:79cf11603e8ca6e4013615d99ec65904bdda4c8c4673a3ced56a72a92abeb653",
      "payload_manifest_ref": "packages/payloads/mas-0.2.24.json",
      "payload_manifest_sha256": "sha256:d965e5495bbdc8da09d9be6328e15f57df4ef7d5e11c97fc96566dc2273b90e4",
      "runtime_module_relative_path": "modules/mas"
    },
    "mag": {
      "package_id": "mag",
      "package_role": "standard_agent",
      "package_version": "0.3.7",
      "owner_source_commit": "85d8152f53e48bc22ee4414ef90124f620edebe8",
      "manifest_ref": "packages/mag-0.3.7.json",
      "manifest_sha256": "sha256:6a49a701b7c45a225a457cde22cc416f3f1d4fdd2e7aad65ea1deae0f1655bfd",
      "payload_manifest_ref": "packages/payloads/mag-0.3.7.json",
      "payload_manifest_sha256": "sha256:cdef06e205e57e1d5282abc8b27c08c6b99c752dea2276e70a30a0609a4a0725",
      "runtime_module_relative_path": "modules/mag"
    },
    "rca": {
      "package_id": "rca",
      "package_role": "standard_agent",
      "package_version": "0.2.12",
      "owner_source_commit": "d79dadaf04cc7a64170b041aed3e17092dee67b8",
      "manifest_ref": "packages/rca-0.2.12.json",
      "manifest_sha256": "sha256:8c6329faad5f982e33f30bff328fef92f4912dfede7c05eb94ba20282f84f9fe",
      "payload_manifest_ref": "packages/payloads/rca-0.2.12.json",
      "payload_manifest_sha256": "sha256:05fd42cd1b8e3ee43ac2ea3e127093bf57d48da1fbb6e6d6a0456349ed43991f",
      "runtime_module_relative_path": "modules/rca"
    },
    "oma": {
      "package_id": "oma",
      "package_role": "standard_agent",
      "package_version": "0.4.6",
      "owner_source_commit": "607b685b8eb668e6ff121a71aec8916ad7ca6016",
      "manifest_ref": "packages/oma-0.4.6.json",
      "manifest_sha256": "sha256:c2e33dcc72edcace5bfc70b455f13256b92dda1c5a3fbea282a22c598e129372",
      "payload_manifest_ref": "packages/payloads/oma-0.4.6.json",
      "payload_manifest_sha256": "sha256:dc4fe9f50eed904462ed4a40ce9cacd74f593a6fabedf6a7cb37a9a066e64a92",
      "runtime_module_relative_path": "modules/meta-agent"
    },
    "obf": {
      "package_id": "obf",
      "package_role": "standard_agent",
      "package_version": "0.3.9",
      "owner_source_commit": "cdf061c309bd1ed685e4fb0e677d29b2b96eb5ca",
      "manifest_ref": "packages/obf-0.3.9.json",
      "manifest_sha256": "sha256:87dbc954cf83a4b25903c84257a0088d06d52170b19f00b8ec5631f59f8659c4",
      "payload_manifest_ref": "packages/payloads/obf-0.3.9.json",
      "payload_manifest_sha256": "sha256:37fdfd83bde4e1e23c95ebc45f58c3ca174fd8d41389d93e433a720984170127",
      "runtime_module_relative_path": "modules/bookforge"
    },
    "mas-scholar-skills": {
      "package_id": "mas-scholar-skills",
      "package_role": "capability_package",
      "package_version": "0.2.24",
      "owner_source_commit": "805149d3649bc20ea4d1b1214e897c5ec66fe41f",
      "manifest_ref": "packages/mas-scholar-skills-0.2.24.json",
      "manifest_sha256": "sha256:698bfc29e1ef250067831d1138e2de836a91f8d011e17acc1f409e586aaaa8cb",
      "payload_manifest_ref": "packages/payloads/mas-scholar-skills-0.2.24.json",
      "payload_manifest_sha256": "sha256:fecd9191a8a75b849d40e08658a3618bc106bdf99c83565f4c60e617d979eef4",
      "runtime_module_relative_path": "modules/mas-scholar-skills"
    },
    "opl-flow": {
      "package_id": "opl-flow",
      "package_role": "workflow_profile",
      "package_version": "0.1.38",
      "owner_source_commit": "f9080e3db3253da63452f4072deaadce3197cef3",
      "manifest_ref": "packages/opl-flow.json",
      "manifest_sha256": "sha256:89ddc9ad18b7bc337edf290e637a77d73e70911cb27dcdcaab35fdddbd0d4c57",
      "payload_manifest_ref": "packages/payloads/opl-flow-0.1.38.json",
      "payload_manifest_sha256": "sha256:43082bb76bed719f07534a26851c521d2b0d2948f93fb4739816eba2ff9de07d",
      "runtime_module_relative_path": "modules/opl-flow"
    }
  }
}
